{"contract_version":"nhi.event_market_snapshot.v1","snapshot_id":"gold_threshold","source_type":"polymarket","verification_status":"user_verified","title":"Synthetic metal threshold","event_domain":"commodities","event_category":"price_threshold","captured_at":"2026-07-01T00:00:00Z","outcomes":[{"name":"Above","threshold_direction":"above","probability":0.61,"tags":["risk_off"]},{"name":"Below","threshold_direction":"below","probability":0.39}],"total_volume":95000,"resolution_rules":"Synthetic rule."}
