{"contract_version":"nhi.event_market_snapshot.v1","snapshot_id":"unverified_extract","source_type":"polymarket","verification_status":"unverified_extraction","title":"Synthetic extracted snapshot","event_domain":"other","event_category":"other","captured_at":"2026-07-01T00:00:00Z","outcomes":[{"name":"Yes","probability":0.6},{"name":"No","probability":0.4}],"total_volume":1000,"resolution_rules":"Synthetic rule."}
