{"contract_version":"nhi.event_market_snapshot.v1","snapshot_id":"fed_split","source_type":"polymarket","verification_status":"user_verified","title":"Synthetic split rate decision","event_domain":"economy_rates","event_category":"rate_decision","captured_at":"2026-07-01T00:00:00Z","outcomes":[{"name":"Hold","probability":0.51,"rate_change_bps":0},{"name":"Cut","probability":0.49,"rate_change_bps":-25}],"total_volume":4000,"resolution_rules":"Synthetic rule."}
