{"contract_version":"nhi.event_market_snapshot.v1","snapshot_id":"hormuz_normal","source_type":"polymarket","verification_status":"user_verified","title":"Synthetic shipping normalization","event_domain":"geopolitics","event_category":"shipping_disruption","captured_at":"2026-07-01T00:00:00Z","outcomes":[{"name":"Normal","probability":0.72,"tags":["normalization"]},{"name":"Disruption","probability":0.28,"tags":["disruption"]}],"total_volume":100000,"resolution_rules":"Synthetic rule."}
