{"contract_version":"nhi.event_market_snapshot.v1","snapshot_id":"ai_release","source_type":"polymarket","verification_status":"user_verified","title":"Synthetic product release timing","event_domain":"technology","event_category":"ai_product_release","captured_at":"2026-07-01T00:00:00Z","outcomes":[{"name":"By date","probability":0.6,"tags":["product_release","narrative_momentum"]},{"name":"Later","probability":0.4}],"total_volume":60000,"resolution_rules":"Synthetic rule."}
