{"contract_version":"nhi.event_market_snapshot.v1","snapshot_id":"fed_hold","source_type":"polymarket","verification_status":"user_verified","title":"Synthetic rate decision","event_domain":"economy_rates","event_category":"rate_decision","captured_at":"2026-07-01T00:00:00Z","outcomes":[{"name":"Hold","probability":0.8,"rate_change_bps":0,"volume":80000},{"name":"Cut","probability":0.15,"rate_change_bps":-25,"volume":15000},{"name":"Hike","probability":0.05,"rate_change_bps":25,"volume":5000}],"total_volume":100000,"bid_ask_available":true,"spread_available":true,"resolution_rules":"Synthetic rule."}
