{"contract_version":"nhi.event_market_snapshot.v1","snapshot_id":"company_rank","source_type":"polymarket","verification_status":"user_verified","title":"Synthetic company leadership","event_domain":"market_structure","event_category":"company_leadership","captured_at":"2026-07-01T00:00:00Z","outcomes":[{"name":"Company A","actor":"Company A","probability":0.68},{"name":"Company B","actor":"Company B","probability":0.32}],"total_volume":150000,"resolution_rules":"Synthetic rule."}
