{"contract_version":"nhi.event_market_snapshot.v1","snapshot_id":"fed_cut_liquidity","source_type":"polymarket","verification_status":"user_corrected","title":"Synthetic cut event","event_domain":"economy_rates","event_category":"rate_cut","captured_at":"2026-07-01T00:00:00Z","outcomes":[{"name":"Cut","probability":0.7,"rate_change_bps":-25,"tags":["liquidity"]},{"name":"Hold","probability":0.3,"rate_change_bps":0}],"total_volume":90000,"resolution_rules":"Synthetic rule."}
