{"contract_version":"nhi.event_market_snapshot.v1","snapshot_id":"weak_signal","source_type":"polymarket","verification_status":"user_verified","title":"Synthetic weak signal","event_domain":"other","event_category":"other","captured_at":"2026-07-01T00:00:00Z","outcomes":[{"name":"Yes","probability":0.55},{"name":"No","probability":0.45}],"total_volume":5,"resolution_rules":"Synthetic rule."}
