{"contract_version":"nhi.event_market_snapshot.v1","snapshot_id":"dual_thesis_event","source_type":"polymarket","verification_status":"user_verified","title":"Synthetic disruption with thesis-dependent direction","event_domain":"geopolitics","event_category":"shipping_disruption","captured_at":"2026-07-01T00:00:00Z","outcomes":[{"name":"Disruption","probability":0.6,"tags":["disruption","oil_shock"]},{"name":"Normal","probability":0.4,"tags":["normalization"]}],"total_volume":80000,"resolution_rules":"Synthetic rule."}
