{"contract_version":"nhi.event_market_snapshot.v1","snapshot_id":"wti_threshold","source_type":"polymarket","verification_status":"user_verified","title":"Synthetic energy threshold","event_domain":"commodities","event_category":"price_threshold","captured_at":"2026-07-01T00:00:00Z","outcomes":[{"name":"Above","threshold_direction":"above","probability":0.57},{"name":"Below","threshold_direction":"below","probability":0.43}],"total_volume":110000,"resolution_rules":"Synthetic rule."}
