{"contract_version":"nhi.event_market_snapshot.v1","snapshot_id":"ai_leadership","source_type":"polymarket","verification_status":"user_verified","title":"Synthetic model leadership","event_domain":"technology","event_category":"actor_leadership","captured_at":"2026-07-01T00:00:00Z","outcomes":[{"name":"Actor A","actor":"Actor A","probability":0.58},{"name":"Actor B","actor":"Actor B","probability":0.42}],"total_volume":85000,"resolution_rules":"Synthetic rule."}
