{"contract_version":"nhi.event_market_snapshot.v1","snapshot_id":"dual_rate_event","source_type":"polymarket","verification_status":"user_verified","title":"Synthetic cut with two channels","event_domain":"economy_rates","event_category":"rate_cut","captured_at":"2026-07-01T00:00:00Z","outcomes":[{"name":"Cut","probability":0.66,"rate_change_bps":-25,"tags":["liquidity","recession_signal"]},{"name":"Hold","probability":0.34,"rate_change_bps":0}],"total_volume":88000,"resolution_rules":"Synthetic rule."}
