{"contract_version":"nhi.event_market_snapshot.v1","snapshot_id":"fed_cut_recession","source_type":"polymarket","verification_status":"user_verified","title":"Synthetic cut event with recession channel","event_domain":"economy_rates","event_category":"rate_cut","captured_at":"2026-07-01T00:00:00Z","outcomes":[{"name":"Cut","probability":0.65,"rate_change_bps":-25,"tags":["recession_signal"]},{"name":"Hold","probability":0.35,"rate_change_bps":0}],"total_volume":70000,"resolution_rules":"Synthetic rule."}
