{"contract_version":"nhi.event_market_snapshot.v1","snapshot_id":"hormuz_disruption","source_type":"polymarket","verification_status":"user_verified","title":"Synthetic shipping disruption","event_domain":"geopolitics","event_category":"shipping_disruption","captured_at":"2026-07-01T00:00:00Z","outcomes":[{"name":"Disruption","probability":0.62,"tags":["disruption","oil_shock"]},{"name":"Normal","probability":0.38,"tags":["normalization"]}],"total_volume":120000,"resolution_rules":"Synthetic rule."}
